### ISSUE TITLE
Linux Network

### ISSUE THREAD

**Issue by nonocast** [nonocast/me#122]
tcpdump
## tcpdump

linux, macOS下都可以通过tcpdump直接抓取任意NIC(network interface)的数据包，`tcpdump -A -i lo0 port 8080`, 这句就可以直接抓本机8080端口的进出数据，8080后面是nginx，然后-A表示通过ascii显示数据内容，-i lo0表示抓loopback，即localhost, 然后返回的数据看上去有点多，其中注意Flags：

- [S]： SYN (建立连接，传说中的三次握手，清清楚楚)
- [.]: 没有 Flag
- [P]: PSH (推送数据)
- [F]: FIN (结束连接)
- [R]: RST (重置连接)

在tcpdump的情况下，再打开一个terminal curl localhost:8080就能显示出如下的交互过程。

```sh
~ sudo tcpdump -A -s0 -i lo0 port 8080
tcpdump: verbose output suppressed, use -v or -vv for full protocol decode
listening on lo0, link-type NULL (BSD loopback), capture size 262144 bytes
01:17:50.863448 IP localhost.54631 > localhost.http-alt: Flags [S], seq 1760942669, win 65535, options [mss 16344,nop,wscale 6,nop,nop,TS val 867415555 ecr 0,sackOK,eol], length 0
E..@..@.@............g..h..M.........4....?........
3...........
01:17:50.863512 IP localhost.http-alt > localhost.54631: Flags [S.], seq 2180866458, ack 1760942670, win 65535, options [mss 16344,nop,wscale 6,nop,nop,TS val 867415555 ecr 867415555,sackOK,eol], length 0
E..@..@.@..............g..a.h..N.....4....?........
3...3.......
01:17:50.863523 IP localhost.54631 > localhost.http-alt: Flags [.], ack 1, win 6379, options [nop,nop,TS val 867415555 ecr 867415555], length 0
E..4..@.@............g..h..N..a......(.....
3...3...
01:17:50.863531 IP localhost.http-alt > localhost.54631: Flags [.], ack 1, win 6379, options [nop,nop,TS val 867415555 ecr 867415555], length 0
E..4..@.@..............g..a.h..N.....(.....
3...3...
01:17:50.863721 IP localhost.54631 > localhost.http-alt: Flags [P.], seq 1:79, ack 1, win 6379, options [nop,nop,TS val 867415555 ecr 867415555], length 78: HTTP: GET / HTTP/1.1
E.....@.@............g..h..N..a......v.....
3...3...GET / HTTP/1.1
Host: localhost:8080
User-Agent: curl/7.64.1
Accept: */*


01:17:50.863732 IP localhost.http-alt > localhost.54631: Flags [.], ack 79, win 6378, options [nop,nop,TS val 867415555 ecr 867415555], length 0
E..4..@.@..............g..a.h........(.....
3...3...
01:17:50.864657 IP localhost.http-alt > localhost.54631: Flags [P.], seq 1:239, ack 79, win 6378, options [nop,nop,TS val 867415556 ecr 867415555], length 238: HTTP: HTTP/1.1 200 OK
E.."..@.@..............g..a.h..............
3...3...HTTP/1.1 200 OK
Server: nginx/1.19.3
Date: Mon, 09 Nov 2020 17:17:50 GMT
Content-Type: text/html
Content-Length: 612
Last-Modified: Tue, 29 Sep 2020 14:32:14 GMT
Connection: keep-alive
ETag: "5f73456e-264"
Accept-Ranges: bytes


01:17:50.864694 IP localhost.54631 > localhost.http-alt: Flags [.], ack 239, win 6375, options [nop,nop,TS val 867415556 ecr 867415556], length 0
E..4..@.@............g..h.....b......(.....
3...3...
01:17:50.865010 IP localhost.http-alt > localhost.54631: Flags [P.], seq 239:851, ack 79, win 6378, options [nop,nop,TS val 867415556 ecr 867415556], length 612: HTTP
E.....@.@..............g..b.h..............
3...3...<!DOCTYPE html>
<html>
<head>
<title>Welcome to nginx!</title>
<style>
    body {
        width: 35em;
        margin: 0 auto;
        font-family: Tahoma, Verdana, Arial, sans-serif;
    }
</style>
</head>
<body>
<h1>Welcome to nginx!</h1>
<p>If you see this page, the nginx web server is successfully installed and
working. Further configuration is required.</p>

<p>For online documentation and support please refer to
<a href="http://nginx.org/">nginx.org</a>.<br/>
Commercial support is available at
<a href="http://nginx.com/">nginx.com</a>.</p>

<p><em>Thank you for using nginx.</em></p>
</body>
</html>

01:17:50.865023 IP localhost.54631 > localhost.http-alt: Flags [.], ack 851, win 6366, options [nop,nop,TS val 867415556 ecr 867415556], length 0
E..4..@.@............g..h.....d......(.....
3...3...
01:17:50.865203 IP localhost.54631 > localhost.http-alt: Flags [F.], seq 79, ack 851, win 6366, options [nop,nop,TS val 867415556 ecr 867415556], length 0
E..4..@.@............g..h.....d......(.....
3...3...
01:17:50.865220 IP localhost.http-alt > localhost.54631: Flags [.], ack 80, win 6378, options [nop,nop,TS val 867415556 ecr 867415556], length 0
E..4..@.@..............g..d.h........(.....
3...3...
01:17:50.865244 IP localhost.http-alt > localhost.54631: Flags [F.], seq 851, ack 80, win 6378, options [nop,nop,TS val 867415556 ecr 867415556], length 0
E..4..@.@..............g..d.h........(.....
3...3...
01:17:50.865266 IP localhost.54631 > localhost.http-alt: Flags [.], ack 852, win 6366, options [nop,nop,TS val 867415556 ecr 867415556], length 0
E..4..@.@............g..h.....d......(.....
3...3...
```

抓一下icmp的ping, 

```sh
~ sudo tcpdump -nnvXSs 0 -c2 icmp
tcpdump: data link type PKTAP
tcpdump: listening on pktap, link-type PKTAP (Apple DLT_PKTAP), capture size 262144 bytes
01:27:25.748248 IP (tos 0x0, ttl 64, id 49197, offset 0, flags [none], proto ICMP (1), length 84)
    192.168.3.7 > 220.181.38.148: ICMP echo request, id 32702, seq 0, length 64
	0x0000:  f0e4 a29d 9464 8c85 9090 6d26 0800 4500  .....d....m&..E.
	0x0010:  0054 c02d 0000 4001 f382 c0a8 0307 dcb5  .T.-..@.........
	0x0020:  2694 0800 46eb 7fbe 0000 5fa9 7bfd 000b  &...F....._.{...
	0x0030:  6aa1 0809 0a0b 0c0d 0e0f 1011 1213 1415  j...............
	0x0040:  1617 1819 1a1b 1c1d 1e1f 2021 2223 2425  ...........!"#$%
	0x0050:  2627 2829 2a2b 2c2d 2e2f 3031 3233 3435  &'()*+,-./012345
	0x0060:  3637                                     67
01:27:25.775660 IP (tos 0x60, ttl 52, id 49197, offset 0, flags [none], proto ICMP (1), length 84)
    220.181.38.148 > 192.168.3.7: ICMP echo reply, id 32702, seq 0, length 64
	0x0000:  8c85 9090 6d26 f0e4 a29d 9464 0800 4560  ....m&.....d..E`
	0x0010:  0054 c02d 0000 3401 ff22 dcb5 2694 c0a8  .T.-..4.."..&...
	0x0020:  0307 0000 4eeb 7fbe 0000 5fa9 7bfd 000b  ....N....._.{...
	0x0030:  6aa1 0809 0a0b 0c0d 0e0f 1011 1213 1415  j...............
	0x0040:  1617 1819 1a1b 1c1d 1e1f 2021 2223 2425  ...........!"#$%
	0x0050:  2627 2829 2a2b 2c2d 2e2f 3031 3233 3435  &'()*+,-./012345
	0x0060:  3637                                     67
2 packets captured
45 packets received by filter
0 packets dropped by kernel
```
